[{"id":"nv.modaka","offered_to":["ganesha"],"occasions":["obs.vinayaka-chavithi","obs.sankashti-chaturthi"],"image":"img.naivedyam.modaka","status":"draft","why":{"te":"మోదకం అంటే \"మోదం\" — ఆనందం ఇచ్చేది. వినాయకుని చేతిలో ఎప్పుడూ మోదకం ఉంటుంది. బయట సాదా పిండి, లోపల తీపి — పైకి సాధారణంగా కనిపించే జ్ఞానం లోపల ఎంత తీపో గుర్తు చేస్తుంది. ఉడికించి చేస్తారు కాబట్టి తేలికగా, శుద్ధంగా ఉంటుంది. ప్రతి ప్రాంతం తన రూపంలో చేస్తుంది — అర్థం ఒకటే.","hi":"मोदक यानी \"मोद\" — आनंद देने वाला। गणेश जी के हाथ में सदा मोदक रहता है। बाहर सादा आटा, भीतर मिठास — जैसे ज्ञान, जो ऊपर से साधारण दिखे पर भीतर मीठा हो। भाप में बनता है, इसलिए हल्का और शुद्ध होता है। हर प्रदेश इसे अपने ढंग से बनाता है — अर्थ एक ही है।","en":"Modaka comes from \"moda\", joy. Ganesha always holds one. Plain dough outside, sweetness inside — like knowledge, simple on the surface and sweet within. It is steamed, so it is light and pure. Every region makes its own form; the meaning is the same."},"regional_forms":[{"name":{"te":"ఉండ్రాళ్ళు","hi":"उंडराल्लु","en":"Undrallu"},"region":["AP","TS"],"note":{"te":"బియ్యపు రవ్వతో చేసే సాదా ఉడికించిన ఉండలు.","hi":"चावल की सूजी से बने सादे भाप में पके गोले।","en":"Plain steamed balls of rice rava."}},{"name":{"te":"కుడుములు","hi":"कुडुमुलु","en":"Kudumulu"},"region":["AP","TS"],"note":{"te":"పప్పు లేదా బెల్లం కలిపిన ఉడికించిన కుడుములు.","hi":"दाल या गुड़ मिलाकर भाप में पकाए जाते हैं।","en":"Steamed dumplings"}},{"name":{"te":"కొళుకట్టై","hi":"कोळुकट्टै","en":"Kozhukattai"},"region":["TN"],"note":{"te":"కొబ్బరి-బెల్లం పూర్ణం నింపిన ఉండలు.","hi":"नारियल-गुड़ भरे हुए।","en":"Filled with coconut and jaggery."}},{"name":{"te":"కడుబు","hi":"कडुबु","en":"Kadubu"},"region":["KA"],"note":{"te":"కర్ణాటకలో కొబ్బరి-బెల్లం పూర్ణంతో.","hi":"कर्नाटक में नारियल-गुड़ भरकर।","en":"Karnataka's filled dumpling."}},{"name":{"te":"మోదకం","hi":"मोदक","en":"Modak"},"region":["MH"],"note":{"te":"ఉకడీచే మోదకం — పూర్ణం నింపి మడతలతో ఉడికిస్తారు.","hi":"उकडीचे मोदक — भरकर","en":"Ukadiche modak — filled"}}]},{"id":"nv.phala","offered_to":["ganesha"],"occasions":["obs.vinayaka-chavithi"],"image":"img.naivedyam.phala","status":"draft","why":{"te":"భాద్రపదంలో ప్రకృతి ఇచ్చే పండ్లను మొదట దేవునికి సమర్పించడం — ఆ కాలానికి కృతజ్ఞత. వెలగ, నేరేడు సంప్రదాయం; మీ దేశంలో దొరికే ఏ కాలపు పండైనా సరే.","hi":"भाद्रपद में प्रकृति जो फल देती है, उन्हें पहले भगवान को अर्पित करना — उस ऋतु के प्रति कृतज्ञता। कैथ और जामुन परंपरा हैं; आप जहाँ हैं वहाँ का कोई भी मौसमी फल ठीक है।","en":"Offering the fruits of Bhadrapada to God first is a thank-you for the season. Wood apple and jamun are traditional; any seasonal fruit where you live is right."},"regional_forms":[{"name":{"te":"వెలగపండు","hi":"कैथ","en":"Wood apple"},"region":["all"],"note":{"te":"చవితి కాలంలో దొరికే పండు.","hi":"चतुर्थी के मौसम का फल।","en":"In season at Chavithi."}},{"name":{"te":"నేరేడు","hi":"जामुन","en":"Jamun"},"region":["all"],"note":{"te":"వర్షాకాలపు పండు.","hi":"बरसात का फल।","en":"A monsoon fruit."}},{"name":{"te":"అరటిపండు","hi":"केला","en":"Banana"},"region":["all"],"note":{"te":"ఏడాదంతా దొరుకుతుంది.","hi":"सालभर मिलता है।","en":"Available all year."}}]}]